{
  "$schema": "./config-schema.json",
  "pages": [
    { "view": "home", "route": "/" },
    { "view": "self-managed-latest-dev", "route": "/self-managed-latest" },
    {
      "view": "self-managed-all-releases-dev",
      "route": "/self-managed-all-releases"
    }
  ],
  "links": [
    {
      "id": "selfmanagedbcppypbadq",
      "title": "BillingCenter",
      "url": "self-managed/bc/1003",
      "pageType": "oxygenWebhelp",
      "metadata": {
        "platform": "Self-managed",
        "product": "BillingCenter",
        "version": "10.0.3"
      }
    },
    {
      "id": "selfmanagedbctnmesrxz",
      "title": "BillingCenter",
      "url": "self-managed/bc/1002",
      "pageType": "oxygenWebhelp",
      "metadata": {
        "platform": "Self-managed",
        "product": "BillingCenter",
        "version": "10.0.2"
      }
    },
    {
      "id": "selfmanagedbcfdwpzjga",
      "title": "BillingCenter",
      "url": "self-managed/bc/1001",
      "pageType": "oxygenWebhelp",
      "metadata": {
        "platform": "Self-managed",
        "product": "BillingCenter",
        "version": "10.0.1"
      }
    },
    {
      "id": "httpsportalguidewirecomportalsecuredocbcillingenterindexhtmlzrfofjtc",
      "title": "BillingCenter",
      "url": "https://portal2.guidewire.com/portal/secure/doc/bc/BillingCenter_10.0.0/index.html",
      "pageType": "portal2",
      "metadata": {
        "platform": "Self-managed",
        "product": "BillingCenter",
        "version": "10.0.0"
      }
    },
    {
      "id": "httpsportalguidewirecomportalsecuredocbcillingenterindexhtmlrlwosjzc",
      "title": "BillingCenter",
      "url": "https://portal2.guidewire.com/portal/secure/doc/bc/BillingCenter_9.0.8/index.html",
      "pageType": "portal2",
      "metadata": {
        "platform": "Self-managed",
        "product": "BillingCenter",
        "version": "9.0.8"
      }
    },
    {
      "id": "httpsportalguidewirecomportalsecuredocbcillingenterindexhtmlrxkvlypo",
      "title": "BillingCenter",
      "url": "https://portal2.guidewire.com/portal/secure/doc/bc/BillingCenter_9.0.7/index.html",
      "pageType": "portal2",
      "metadata": {
        "platform": "Self-managed",
        "product": "BillingCenter",
        "version": "9.0.7"
      }
    },
    {
      "id": "httpsportalguidewirecomportalsecuredocbcillingenterindexhtmluleishgj",
      "title": "BillingCenter",
      "url": "https://portal2.guidewire.com/portal/secure/doc/bc/BillingCenter_9.0.6/index.html",
      "pageType": "portal2",
      "metadata": {
        "platform": "Self-managed",
        "product": "BillingCenter",
        "version": "9.0.6"
      }
    },
    {
      "id": "httpsportalguidewirecomportalsecuredocbcillingenterindexhtmlvhqrxxso",
      "title": "BillingCenter",
      "url": "https://portal2.guidewire.com/portal/secure/doc/bc/BillingCenter_9.0.5/index.html",
      "pageType": "portal2",
      "metadata": {
        "platform": "Self-managed",
        "product": "BillingCenter",
        "version": "9.0.5"
      }
    },
    {
      "id": "httpsportalguidewirecomportalsecuredocbcillingenterdocindexhtmlskyxwqbr",
      "title": "BillingCenter",
      "url": "https://portal2.guidewire.com/portal/secure/doc/bc/BillingCenter_9.0.4/doc/index.html",
      "pageType": "portal2",
      "metadata": {
        "platform": "Self-managed",
        "product": "BillingCenter",
        "version": "9.0.4"
      }
    },
    {
      "id": "httpsportalguidewirecomportalsecuredocbcillingenterdocindexhtmluaykxhzw",
      "title": "BillingCenter",
      "url": "https://portal2.guidewire.com/portal/secure/doc/bc/BillingCenter_9.0.3/doc/index.html",
      "pageType": "portal2",
      "metadata": {
        "platform": "Self-managed",
        "product": "BillingCenter",
        "version": "9.0.3"
      }
    },
    {
      "id": "httpsportalguidewirecomportalsecuredocbcillingenterdocindexhtmlzilplqci",
      "title": "BillingCenter",
      "url": "https://portal2.guidewire.com/portal/secure/doc/bc/BillingCenter_9.0.2/doc/index.html",
      "pageType": "portal2",
      "metadata": {
        "platform": "Self-managed",
        "product": "BillingCenter",
        "version": "9.0.2"
      }
    },
    {
      "id": "httpsportalguidewirecomportalsecuredocbcillingenterdocindexhtmlocbqfnfe",
      "title": "BillingCenter",
      "url": "https://portal2.guidewire.com/portal/secure/doc/bc/BillingCenter_9.0.1/doc/index.html",
      "pageType": "portal2",
      "metadata": {
        "platform": "Self-managed",
        "product": "BillingCenter",
        "version": "9.0.1"
      }
    },
    {
      "id": "httpsportalguidewirecomportalsecuredocbcillingenterdocindexhtmloecjqgsa",
      "title": "BillingCenter",
      "url": "https://portal2.guidewire.com/portal/secure/doc/bc/BillingCenter_9.0.0/doc/index.html",
      "pageType": "portal2",
      "metadata": {
        "platform": "Self-managed",
        "product": "BillingCenter",
        "version": "9.0.0"
      }
    },
    {
      "id": "httpsportalguidewirecomportalsecuredocbcillingenterdoclgknogoq",
      "title": "BillingCenter",
      "url": "https://portal2.guidewire.com/portal/secure/doc/bc/BillingCenter_8.0.7/doc/",
      "pageType": "portal2",
      "metadata": {
        "platform": "Self-managed",
        "product": "BillingCenter",
        "version": "8.0.7"
      }
    },
    {
      "id": "httpsportalguidewirecomportalsecuredocbcillingenterdocrwafpooh",
      "title": "BillingCenter",
      "url": "https://portal2.guidewire.com/portal/secure/doc/bc/BillingCenter_8.0.6/doc/",
      "pageType": "portal2",
      "metadata": {
        "platform": "Self-managed",
        "product": "BillingCenter",
        "version": "8.0.6"
      }
    },
    {
      "id": "httpsportalguidewirecomportalsecuredocbcillingenterdocpqdupbhg",
      "title": "BillingCenter",
      "url": "https://portal2.guidewire.com/portal/secure/doc/bc/BillingCenter_8.0.5/doc/",
      "pageType": "portal2",
      "metadata": {
        "platform": "Self-managed",
        "product": "BillingCenter",
        "version": "8.0.5"
      }
    },
    {
      "id": "httpsportalguidewirecomportalsecuredocbcillingenterdocnqfuedsc",
      "title": "BillingCenter",
      "url": "https://portal2.guidewire.com/portal/secure/doc/bc/BillingCenter_8.0.4/doc/",
      "pageType": "portal2",
      "metadata": {
        "platform": "Self-managed",
        "product": "BillingCenter",
        "version": "8.0.4"
      }
    },
    {
      "id": "httpsportalguidewirecomportalsecuredocbcillingenterdocxubburnq",
      "title": "BillingCenter",
      "url": "https://portal2.guidewire.com/portal/secure/doc/bc/BillingCenter_8.0.3/doc/",
      "pageType": "portal2",
      "metadata": {
        "platform": "Self-managed",
        "product": "BillingCenter",
        "version": "8.0.3"
      }
    },
    {
      "id": "httpsportalguidewirecomportalsecuredocbcillingenterdocdshtuisn",
      "title": "BillingCenter",
      "url": "https://portal2.guidewire.com/portal/secure/doc/bc/BillingCenter_8.0.2/doc/",
      "pageType": "portal2",
      "metadata": {
        "platform": "Self-managed",
        "product": "BillingCenter",
        "version": "8.0.2"
      }
    },
    {
      "id": "httpsportalguidewirecomportalsecuredocbcillingenterdocrlhufvsc",
      "title": "BillingCenter",
      "url": "https://portal2.guidewire.com/portal/secure/doc/bc/BillingCenter_8.0.1/doc/",
      "pageType": "portal2",
      "metadata": {
        "platform": "Self-managed",
        "product": "BillingCenter",
        "version": "8.0.1"
      }
    },
    {
      "id": "httpsportalguidewirecomportalsecuredocbcillingenterdoculdoiyfk",
      "title": "BillingCenter",
      "url": "https://portal2.guidewire.com/portal/secure/doc/bc/BillingCenter_8.0.0/doc/",
      "pageType": "portal2",
      "metadata": {
        "platform": "Self-managed",
        "product": "BillingCenter",
        "version": "8.0.0"
      }
    },
    {
      "id": "httpsportalguidewirecomportalsecuredocbcillingenterdociazmuaja",
      "title": "BillingCenter",
      "url": "https://portal2.guidewire.com/portal/secure/doc/bc/BillingCenter_7.0.8/doc/",
      "pageType": "portal2",
      "metadata": {
        "platform": "Self-managed",
        "product": "BillingCenter",
        "version": "7.0.8"
      }
    },
    {
      "id": "httpsportalguidewirecomportalsecuredocbcillingenterdocfjgzsxug",
      "title": "BillingCenter",
      "url": "https://portal2.guidewire.com/portal/secure/doc/bc/BillingCenter_7.0.7/doc/",
      "pageType": "portal2",
      "metadata": {
        "platform": "Self-managed",
        "product": "BillingCenter",
        "version": "7.0.7"
      }
    },
    {
      "id": "httpsportalguidewirecomportalsecuredocbcillingenterdocdgvtlrvo",
      "title": "BillingCenter",
      "url": "https://portal2.guidewire.com/portal/secure/doc/bc/BillingCenter_7.0.6/doc/",
      "pageType": "portal2",
      "metadata": {
        "platform": "Self-managed",
        "product": "BillingCenter",
        "version": "7.0.6"
      }
    },
    {
      "id": "httpsportalguidewirecomportalsecuredocbcillingenterdocudtzgidf",
      "title": "BillingCenter",
      "url": "https://portal2.guidewire.com/portal/secure/doc/bc/BillingCenter_7.0.5/doc/",
      "pageType": "portal2",
      "metadata": {
        "platform": "Self-managed",
        "product": "BillingCenter",
        "version": "7.0.5"
      }
    },
    {
      "id": "httpsportalguidewirecomportalsecuredocbcillingenterdocfrfoalhc",
      "title": "BillingCenter",
      "url": "https://portal2.guidewire.com/portal/secure/doc/bc/BillingCenter_7.0.4/doc/",
      "pageType": "portal2",
      "metadata": {
        "platform": "Self-managed",
        "product": "BillingCenter",
        "version": "7.0.4"
      }
    },
    {
      "id": "httpsportalguidewirecomportalsecuredocbcillingenterdochzpelmbs",
      "title": "BillingCenter",